{
  "$schema": "../objects.schema.json",
  "objectId": "collectible.stone-pile",
  "selection": "authored",
  "variants": [
    {
      "assetId": "sheet.resources.starter-materials.2x1",
      "frames": [
        {
          "visualId": "stone-pile",
          "frame": 1,
          "displayName": "Stone pile",
          "scale": 0.6,
          "visualOffset": { "x": 0, "y": 0 }
        }
      ]
    }
  ],
  "physics": null,
  "behavior": "collectible.walk-over",
  "collectible": {
    "itemId": "stone",
    "quantity": 10
  },
  "tags": ["collectible", "stone", "material"]
}

